{
  "$schema": "https://json-schema.org/draft/2020-12/schema",
  "$id": "https://university.owaspblt.org/schemas/vulnerability-intel.schema.json",
  "title": "BLT University vulnerability intelligence dataset",
  "type": "object",
  "required": ["schema_version", "generated_at", "dataset_status", "period", "summary", "data_quality", "categories", "spotlights"],
  "properties": {
    "schema_version": {"const": 1},
    "generated_at": {"type": "string", "format": "date-time"},
    "dataset_status": {"enum": ["live", "insufficient_data"]},
    "notice": {"type": "string"},
    "period": {
      "type": "object",
      "required": ["from", "to", "days"],
      "properties": {
        "from": {"type": "string", "format": "date"},
        "to": {"type": "string", "format": "date"},
        "days": {"type": "integer", "minimum": 1}
      },
      "additionalProperties": false
    },
    "summary": {
      "type": "object",
      "required": ["total_cves", "classified_cves", "known_exploited", "critical_cves"],
      "properties": {
        "total_cves": {"type": "integer", "minimum": 0},
        "classified_cves": {"type": "integer", "minimum": 0},
        "known_exploited": {"type": "integer", "minimum": 0},
        "critical_cves": {"type": "integer", "minimum": 0}
      },
      "additionalProperties": false
    },
    "data_quality": {
      "type": "object",
      "required": ["coverage", "structured_cwe", "description_fallback", "unclassified"],
      "properties": {
        "coverage": {"type": "number", "minimum": 0, "maximum": 1},
        "structured_cwe": {"type": "integer", "minimum": 0},
        "description_fallback": {"type": "integer", "minimum": 0},
        "unclassified": {"type": "integer", "minimum": 0}
      },
      "additionalProperties": false
    },
    "categories": {
      "type": "array",
      "items": {"$ref": "#/$defs/category"}
    },
    "spotlights": {
      "type": "array",
      "items": {"$ref": "#/$defs/spotlight"}
    }
  },
  "$defs": {
    "lab": {
      "type": "object",
      "required": ["slug", "title", "reason"],
      "properties": {
        "slug": {"type": "string"},
        "title": {"type": "string"},
        "reason": {"type": "string"}
      },
      "additionalProperties": false
    },
    "month": {
      "type": "object",
      "required": ["month", "count", "complete"],
      "properties": {
        "month": {"type": "string", "pattern": "^[0-9]{4}-[0-9]{2}$"},
        "count": {"type": "integer", "minimum": 0},
        "complete": {
          "type": "boolean",
          "description": "False when the collection window covers only part of this month, so its count is not comparable."
        }
      },
      "additionalProperties": false
    },
    "category": {
      "type": "object",
      "required": ["id", "name", "description", "defensive_principle", "count", "known_exploited", "trend_percent", "trend_months", "severity", "common_cwes", "monthly_counts", "labs"],
      "properties": {
        "id": {"type": "string", "pattern": "^A(0[1-9]|10)$"},
        "name": {"type": "string"},
        "description": {"type": "string"},
        "defensive_principle": {"type": "string"},
        "count": {"type": "integer", "minimum": 0},
        "known_exploited": {"type": "integer", "minimum": 0},
        "trend_percent": {"type": ["number", "null"]},
        "trend_months": {
          "type": ["array", "null"],
          "description": "The two fully-covered months trend_percent compares, oldest first. Null when the window has fewer than two.",
          "items": {"type": "string", "pattern": "^[0-9]{4}-[0-9]{2}$"},
          "minItems": 2,
          "maxItems": 2
        },
        "severity": {
          "type": "object",
          "required": ["critical", "high", "medium", "low", "unknown"],
          "properties": {
            "critical": {"type": "integer", "minimum": 0},
            "high": {"type": "integer", "minimum": 0},
            "medium": {"type": "integer", "minimum": 0},
            "low": {"type": "integer", "minimum": 0},
            "unknown": {"type": "integer", "minimum": 0}
          },
          "additionalProperties": false
        },
        "common_cwes": {"type": "array", "items": {"type": "string"}},
        "monthly_counts": {"type": "array", "items": {"$ref": "#/$defs/month"}},
        "labs": {"type": "array", "items": {"$ref": "#/$defs/lab"}}
      },
      "additionalProperties": false
    },
    "spotlight": {
      "type": "object",
      "required": ["cve_id", "published", "description", "category_id", "category_name", "cwes", "severity", "score", "known_exploited", "classification_method", "confidence", "affected_products", "reference_url", "labs"],
      "properties": {
        "cve_id": {"type": "string", "pattern": "^CVE-[0-9]{4}-[0-9]{4,}$"},
        "published": {"type": "string", "format": "date"},
        "description": {"type": "string"},
        "category_id": {"type": "string"},
        "category_name": {"type": "string"},
        "cwes": {"type": "array", "items": {"type": "string"}},
        "severity": {"enum": ["CRITICAL", "HIGH", "MEDIUM", "LOW", "UNKNOWN"]},
        "score": {"type": ["number", "null"]},
        "known_exploited": {"type": "boolean"},
        "classification_method": {"enum": ["structured_cwe", "description_fallback"]},
        "confidence": {"type": "number", "minimum": 0, "maximum": 1},
        "affected_products": {"type": "array", "items": {"type": "string"}},
        "reference_url": {"type": "string", "format": "uri"},
        "labs": {"type": "array", "items": {"$ref": "#/$defs/lab"}}
      },
      "additionalProperties": false
    }
  },
  "additionalProperties": false
}
