{
  "schema_version": 1,
  "generated_at": "2026-08-16T17:19:13Z",
  "dataset_status": "live",
  "notice": "Published CVEs are grouped for education; this is not a risk score or patch-priority list.",
  "period": {
    "from": "2026-05-19",
    "to": "2026-08-16",
    "days": 90
  },
  "summary": {
    "total_cves": 26557,
    "classified_cves": 17230,
    "known_exploited": 44,
    "critical_cves": 2586
  },
  "data_quality": {
    "coverage": 0.6488,
    "structured_cwe": 16613,
    "description_fallback": 617,
    "unclassified": 9327
  },
  "categories": [
    {
      "id": "A01",
      "name": "Broken Access Control",
      "description": "Authorization failures let users act outside their intended permissions or access resources they do not own.",
      "defensive_principle": "Deny by default and enforce object- and function-level authorization on every request.",
      "count": 6156,
      "known_exploited": 9,
      "trend_percent": 55.6,
      "trend_months": [
        "2026-06",
        "2026-07"
      ],
      "severity": {
        "critical": 601,
        "high": 2273,
        "medium": 2846,
        "low": 428,
        "unknown": 8
      },
      "common_cwes": [
        "CWE-284",
        "CWE-862",
        "CWE-22",
        "CWE-200"
      ],
      "monthly_counts": [
        {
          "month": "2026-05",
          "count": 567,
          "complete": false
        },
        {
          "month": "2026-06",
          "count": 1702,
          "complete": true
        },
        {
          "month": "2026-07",
          "count": 2648,
          "complete": true
        },
        {
          "month": "2026-08",
          "count": 1239,
          "complete": false
        }
      ],
      "labs": [
        {
          "slug": "insecure_direct_object_reference",
          "title": "Insecure Direct Object Reference",
          "reason": "Practice object-level authorization checks."
        },
        {
          "slug": "cross_site_request_forgery",
          "title": "Cross-Site Request Forgery",
          "reason": "Understand authorization of state-changing requests."
        },
        {
          "slug": "open_redirect",
          "title": "Open Redirect",
          "reason": "Learn to constrain user-controlled navigation."
        }
      ]
    },
    {
      "id": "A02",
      "name": "Cryptographic Failures",
      "description": "Sensitive information is exposed when encryption, key management, or transport protection is missing or incorrectly implemented.",
      "defensive_principle": "Minimize sensitive data, use modern cryptography, and protect data both at rest and in transit.",
      "count": 456,
      "known_exploited": 1,
      "trend_percent": -8.3,
      "trend_months": [
        "2026-06",
        "2026-07"
      ],
      "severity": {
        "critical": 74,
        "high": 173,
        "medium": 144,
        "low": 59,
        "unknown": 6
      },
      "common_cwes": [
        "CWE-347",
        "CWE-327",
        "CWE-321",
        "CWE-338"
      ],
      "monthly_counts": [
        {
          "month": "2026-05",
          "count": 36,
          "complete": false
        },
        {
          "month": "2026-06",
          "count": 156,
          "complete": true
        },
        {
          "month": "2026-07",
          "count": 143,
          "complete": true
        },
        {
          "month": "2026-08",
          "count": 121,
          "complete": false
        }
      ],
      "labs": [
        {
          "slug": "sensitive_data_exposure",
          "title": "Sensitive Data Exposure",
          "reason": "Practice protecting secrets and sensitive information."
        }
      ]
    },
    {
      "id": "A03",
      "name": "Injection",
      "description": "Untrusted data changes the meaning of a command, query, or document interpreted by another component.",
      "defensive_principle": "Keep commands and data separate, validate input, and encode output for its exact context.",
      "count": 5745,
      "known_exploited": 13,
      "trend_percent": -2.4,
      "trend_months": [
        "2026-06",
        "2026-07"
      ],
      "severity": {
        "critical": 888,
        "high": 2127,
        "medium": 2223,
        "low": 494,
        "unknown": 13
      },
      "common_cwes": [
        "CWE-79",
        "CWE-89",
        "CWE-20",
        "CWE-78"
      ],
      "monthly_counts": [
        {
          "month": "2026-05",
          "count": 767,
          "complete": false
        },
        {
          "month": "2026-06",
          "count": 1979,
          "complete": true
        },
        {
          "month": "2026-07",
          "count": 1931,
          "complete": true
        },
        {
          "month": "2026-08",
          "count": 1068,
          "complete": false
        }
      ],
      "labs": [
        {
          "slug": "sql_injection",
          "title": "SQL Injection",
          "reason": "Learn parameterized queries and database input handling."
        },
        {
          "slug": "cross_site_scripting_xss",
          "title": "Cross-Site Scripting",
          "reason": "Practice safe output handling across browser contexts."
        },
        {
          "slug": "command_injection",
          "title": "Command Injection",
          "reason": "Learn to keep operating-system commands and input separate."
        }
      ]
    },
    {
      "id": "A04",
      "name": "Insecure Design",
      "description": "Missing or ineffective security controls in the design create weaknesses that implementation fixes alone cannot address.",
      "defensive_principle": "Use threat modeling, abuse cases, secure design patterns, and verifiable security requirements.",
      "count": 1528,
      "known_exploited": 6,
      "trend_percent": 5.7,
      "trend_months": [
        "2026-06",
        "2026-07"
      ],
      "severity": {
        "critical": 253,
        "high": 622,
        "medium": 510,
        "low": 141,
        "unknown": 2
      },
      "common_cwes": [
        "CWE-269",
        "CWE-266",
        "CWE-434",
        "CWE-451"
      ],
      "monthly_counts": [
        {
          "month": "2026-05",
          "count": 144,
          "complete": false
        },
        {
          "month": "2026-06",
          "count": 546,
          "complete": true
        },
        {
          "month": "2026-07",
          "count": 577,
          "complete": true
        },
        {
          "month": "2026-08",
          "count": 261,
          "complete": false
        }
      ],
      "labs": [
        {
          "slug": "file_upload_vulnerabilities",
          "title": "File Upload Vulnerabilities",
          "reason": "Explore security controls for a high-risk application feature."
        },
        {
          "slug": "broken_authentication",
          "title": "Broken Authentication",
          "reason": "Review authentication design and abuse cases."
        }
      ]
    },
    {
      "id": "A05",
      "name": "Security Misconfiguration",
      "description": "Unsafe defaults, unnecessary features, exposed diagnostics, and inconsistent hardening leave systems vulnerable.",
      "defensive_principle": "Apply repeatable hardening, least functionality, safe defaults, and environment-specific configuration review.",
      "count": 143,
      "known_exploited": 0,
      "trend_percent": 21.4,
      "trend_months": [
        "2026-06",
        "2026-07"
      ],
      "severity": {
        "critical": 17,
        "high": 66,
        "medium": 47,
        "low": 10,
        "unknown": 3
      },
      "common_cwes": [
        "CWE-611",
        "CWE-942",
        "CWE-614",
        "CWE-15"
      ],
      "monthly_counts": [
        {
          "month": "2026-05",
          "count": 17,
          "complete": false
        },
        {
          "month": "2026-06",
          "count": 42,
          "complete": true
        },
        {
          "month": "2026-07",
          "count": 51,
          "complete": true
        },
        {
          "month": "2026-08",
          "count": 33,
          "complete": false
        }
      ],
      "labs": [
        {
          "slug": "sensitive_data_exposure",
          "title": "Sensitive Data Exposure",
          "reason": "Identify unsafe diagnostics and exposed configuration."
        },
        {
          "slug": "file_upload_vulnerabilities",
          "title": "File Upload Vulnerabilities",
          "reason": "Practice hardening upload configuration and storage."
        }
      ]
    },
    {
      "id": "A06",
      "name": "Vulnerable and Outdated Components",
      "description": "Applications inherit known risk from unsupported or vulnerable libraries, frameworks, and platforms.",
      "defensive_principle": "Maintain an inventory, monitor disclosures, remove unused dependencies, and patch according to risk.",
      "count": 37,
      "known_exploited": 0,
      "trend_percent": -8.3,
      "trend_months": [
        "2026-06",
        "2026-07"
      ],
      "severity": {
        "critical": 4,
        "high": 9,
        "medium": 13,
        "low": 3,
        "unknown": 8
      },
      "common_cwes": [
        "CWE-1104",
        "CWE-667",
        "CWE-400",
        "CWE-1321"
      ],
      "monthly_counts": [
        {
          "month": "2026-05",
          "count": 2,
          "complete": false
        },
        {
          "month": "2026-06",
          "count": 12,
          "complete": true
        },
        {
          "month": "2026-07",
          "count": 11,
          "complete": true
        },
        {
          "month": "2026-08",
          "count": 12,
          "complete": false
        }
      ],
      "labs": []
    },
    {
      "id": "A07",
      "name": "Identification and Authentication Failures",
      "description": "Weak identity, credential, and session controls let attackers impersonate users or retain unauthorized access.",